{
  "version": 1,
  "workspace": {
    "name": "CREATE SOMETHING",
    "provider": "dify_cloud",
    "base_url": "https://cloud.dify.ai"
  },
  "status": "partial",
  "snapshot": {
    "last_manual_inventory_at": "2026-04-29",
    "source": "Dify Studio manual import plus repo-side smoke/eval evidence",
    "notes": "This inventory is intentionally partial until all existing Dify MCP server cards and apps are exported or manually transcribed."
  },
  "mcp_servers": {
    "yt-transcript-notion": {
      "display_name": "YouTube Transcript + Notion MCP",
      "source_mcp_registry_server": "youtube-transcript-notion-mcp",
      "transport": "http",
      "url": "https://youtube-transcript-notion-mcp.createsomething.workers.dev/mcp",
      "auth": {
        "type": "bearer",
        "infisical": {
          "environment": "prod",
          "path": "/youtube-transcript-notion-mcp",
          "secret_key": "MCP_BEARER_TOKEN"
        }
      },
      "tools": [
        {
          "name": "extract_transcript",
          "enabled": true,
          "risk": "read",
          "required_parameters": ["videoUrl"]
        },
        {
          "name": "get_database_schema",
          "enabled": true,
          "risk": "read",
          "required_parameters": []
        },
        {
          "name": "sync_video_to_notion",
          "enabled": true,
          "risk": "write",
          "required_parameters": ["videoUrl"],
          "requires_user_confirmation": true
        },
        {
          "name": "enrich_notion_page",
          "enabled": true,
          "risk": "write",
          "required_parameters": ["pageId"],
          "requires_user_confirmation": true
        },
        {
          "name": "search",
          "enabled": false,
          "risk": "read",
          "notes": "Generic MCP resource-discovery tool; keep disabled unless the Dify agent needs resource search."
        },
        {
          "name": "fetch",
          "enabled": false,
          "risk": "read",
          "notes": "Generic MCP resource-fetch tool; keep disabled unless the Dify agent needs resource fetch."
        }
      ]
    },
    "blondish_hub": {
      "display_name": "BLOND:ISH HUB",
      "transport": "http",
      "url": "https://blondish.mcp.createsomething.agency/mcp",
      "auth": {
        "type": "bearer",
        "infisical": {
          "environment": "prod",
          "path": "/mcp-hub/hubs",
          "secret_key": "CS_HUB_BLONDISH_API_TOKEN"
        }
      },
      "tools": [
        {
          "name": "hub_describe_proxy_tool",
          "enabled": true,
          "risk": "read",
          "notes": "DSL parameters: proxyToolName"
        },
        {
          "name": "hub_execute_proxy_tool",
          "enabled": true,
          "risk": "external_side_effect",
          "requires_user_confirmation": true,
          "notes": "DSL parameters: args, proxyToolName"
        },
        {
          "name": "hub_get_proxy_tool",
          "enabled": true,
          "risk": "read",
          "notes": "DSL parameters: proxyToolName"
        },
        {
          "name": "hub_list_discovery_packs",
          "enabled": true,
          "risk": "read"
        },
        {
          "name": "hub_list_proxy_tools",
          "enabled": true,
          "risk": "read"
        },
        {
          "name": "hub_list_registry",
          "enabled": true,
          "risk": "read"
        },
        {
          "name": "hub_list_services",
          "enabled": true,
          "risk": "read"
        },
        {
          "name": "hub_policy_status",
          "enabled": true,
          "risk": "read"
        },
        {
          "name": "hub_refresh_connections",
          "enabled": true,
          "risk": "external_side_effect",
          "requires_user_confirmation": true
        },
        {
          "name": "hub_route_intent",
          "enabled": true,
          "risk": "read",
          "notes": "DSL parameters: allowDiscoveryFallback, intent, limit, query, serverName"
        },
        {
          "name": "hub_run_intent",
          "enabled": true,
          "risk": "external_side_effect",
          "requires_user_confirmation": true,
          "notes": "DSL parameters: allowDiscoveryFallback, args, intent, limit, query, serverName"
        },
        {
          "name": "hub_run_proxy_tool",
          "enabled": true,
          "risk": "external_side_effect",
          "requires_user_confirmation": true,
          "notes": "DSL parameters: args, proxyToolName"
        },
        {
          "name": "hub_search_proxy_tools",
          "enabled": true,
          "risk": "read",
          "notes": "DSL parameters: cursor, limit, query, serverName"
        },
        {
          "name": "hub_set_discovery",
          "enabled": true,
          "risk": "external_side_effect",
          "requires_user_confirmation": true,
          "notes": "DSL parameters: activeServers, maxProxyTools, mode, pack, reset"
        },
        {
          "name": "hub_status",
          "enabled": true,
          "risk": "read"
        },
        {
          "name": "hub_trace_lookup",
          "enabled": true,
          "risk": "read",
          "notes": "DSL parameters: correlationId, limit"
        },
        {
          "name": "hub_update_state",
          "enabled": true,
          "risk": "external_side_effect",
          "requires_user_confirmation": true,
          "notes": "DSL parameters: disableBundles, disableServers, enableBundles, enableServers, setBundles, setServers, writeCodexConfig"
        }
      ]
    },
    "morgan_hub": {
      "display_name": "MORGAN HUB",
      "transport": "http",
      "url": "https://morgan-young-c3-management.mcp.createsomething.agency/mcp",
      "auth": {
        "type": "bearer",
        "infisical": {
          "environment": "prod",
          "path": "/mcp-hub/hubs",
          "secret_key": "CS_HUB_MORGAN_YOUNG_C3_MANAGEMENT_API_TOKEN"
        }
      },
      "tools": [
        {
          "name": "hub_describe_proxy_tool",
          "enabled": true,
          "risk": "read",
          "notes": "DSL parameters: proxyToolName"
        },
        {
          "name": "hub_execute_proxy_tool",
          "enabled": true,
          "risk": "external_side_effect",
          "requires_user_confirmation": true,
          "notes": "DSL parameters: args, proxyToolName"
        },
        {
          "name": "hub_get_proxy_tool",
          "enabled": true,
          "risk": "read",
          "notes": "DSL parameters: proxyToolName"
        },
        {
          "name": "hub_list_discovery_packs",
          "enabled": true,
          "risk": "read"
        },
        {
          "name": "hub_list_proxy_tools",
          "enabled": true,
          "risk": "read"
        },
        {
          "name": "hub_list_registry",
          "enabled": true,
          "risk": "read"
        },
        {
          "name": "hub_list_services",
          "enabled": true,
          "risk": "read"
        },
        {
          "name": "hub_policy_status",
          "enabled": true,
          "risk": "read"
        },
        {
          "name": "hub_refresh_connections",
          "enabled": true,
          "risk": "external_side_effect",
          "requires_user_confirmation": true
        },
        {
          "name": "hub_route_intent",
          "enabled": true,
          "risk": "read",
          "notes": "DSL parameters: allowDiscoveryFallback, intent, limit, query, serverName"
        },
        {
          "name": "hub_run_intent",
          "enabled": true,
          "risk": "external_side_effect",
          "requires_user_confirmation": true,
          "notes": "DSL parameters: allowDiscoveryFallback, args, intent, limit, query, serverName"
        },
        {
          "name": "hub_run_proxy_tool",
          "enabled": true,
          "risk": "external_side_effect",
          "requires_user_confirmation": true,
          "notes": "DSL parameters: args, proxyToolName"
        },
        {
          "name": "hub_search_proxy_tools",
          "enabled": true,
          "risk": "read",
          "notes": "DSL parameters: cursor, limit, query, serverName"
        },
        {
          "name": "hub_set_discovery",
          "enabled": true,
          "risk": "external_side_effect",
          "requires_user_confirmation": true,
          "notes": "DSL parameters: activeServers, maxProxyTools, mode, pack, reset"
        },
        {
          "name": "hub_status",
          "enabled": true,
          "risk": "read"
        },
        {
          "name": "hub_trace_lookup",
          "enabled": true,
          "risk": "read",
          "notes": "DSL parameters: correlationId, limit"
        },
        {
          "name": "hub_update_state",
          "enabled": true,
          "risk": "external_side_effect",
          "requires_user_confirmation": true,
          "notes": "DSL parameters: disableBundles, disableServers, enableBundles, enableServers, setBundles, setServers, writeCodexConfig"
        }
      ]
    },
    "viv_hub": {
      "display_name": "VIV HUB",
      "transport": "http",
      "url": "https://viv-blondish.mcp.createsomething.agency/mcp",
      "auth": {
        "type": "bearer",
        "infisical": {
          "environment": "prod",
          "path": "/mcp-hub/hubs",
          "secret_key": "CS_HUB_VIV_BLONDISH_API_TOKEN"
        }
      },
      "tools": [
        {
          "name": "hub_describe_proxy_tool",
          "enabled": true,
          "risk": "read",
          "notes": "DSL parameters: proxyToolName"
        },
        {
          "name": "hub_execute_proxy_tool",
          "enabled": true,
          "risk": "external_side_effect",
          "requires_user_confirmation": true,
          "notes": "DSL parameters: args, proxyToolName"
        },
        {
          "name": "hub_get_proxy_tool",
          "enabled": true,
          "risk": "read",